id,submitted,updated,title,abstract,authors,affiliations,link_abstract,link_pdf,link_doi,comment,journal_ref,doi,primary_category,categories
1011.2079v1,2010-11-09 13:37:24,2010-11-09 13:37:24,"Huge progeny production during the transient of a quasi-species model of
  viral infection, reproduction and mutation","  Eigen's quasi-species model describes viruses as ensembles of different
mutants of a high fitness ""master"" genotype. Mutants are assumed to have lower
fitness than the master type, yet they coexist with it forming the
quasi-species. When the mutation rate is sufficiently high, the master type no
longer survives and gets replaced by a wide range of mutant types, thus
destroying the quasi-species. It is the so-called ""error catastrophe"". But
natural selection acts on phenotypes, not genotypes, and huge amounts of
genotypes yield the same phenotype. An important consequence of this is the
appearance of beneficial mutations which increase the fitness of mutants. A
model has been recently proposed to describe quasi-species in the presence of
beneficial mutations. This model lacks the error catastrophe of Eigen's model
and predicts a steady state in which the viral population grows exponentially.
Extinction can only occur if the infectivity of the quasi-species is so low
that this exponential is negative. In this work I investigate the transient of
this model when infection is started from a small amount of low fitness
virions. I prove that, beyond an initial regime where viral population
decreases (and can go extinct), the growth of the population is
super-exponential. Hence this population quickly becomes so huge that selection
due to lack of host cells to be infected begins to act before the steady state
is reached. This result suggests that viral infection may widespread before the
virus has developed its optimal form.
",Jose A. Cuesta,,http://arxiv.org/abs/1011.2079v1,http://arxiv.org/pdf/1011.2079v1,http://dx.doi.org/10.1016/j.mcm.2010.11.055,"9 pages, no figures, uses Elsevier elsarticle class","Mathematical and Computer Modelling 54, 1676-1681 (2011)",10.1016/j.mcm.2010.11.055,q-bio.PE,"q-bio.PE|physics.bio-ph|92D15, 92D25, 92D30, 05A15"
1103.2760v1,2011-03-14 19:53:52,2011-03-14 19:53:52,"Self-assembly of 2D membranes from mixtures of hard rods and depleting
  polymers","  We elucidate the molecular forces leading to assembly of two dimensional
membrane-like structures composed of a one rod-length thick monolayer of
aligned rods from an immiscible suspension of hard rods and depleting polymers.
We perform simulations which predict that monolayer membranes are
thermodynamically stable above a critical rod aspect ratio and below a critical
depletion interaction length scale. Outside of these conditions alternative
structures such as stacked smectic columns or nematic droplets are
thermodynamically stable. These predictions are confirmed using an experimental
model system of virus rod-like molecules and non-adsorbing polymer. Our work
demonstrates that collective molecular protrusion fluctuations alone are
sufficient to stabilize membranes composed of homogenous rods with simple
excluded volume interactions.
",Yasheng Yang|Edward Barry|Zvonimir Dogic|Michael F. Hagan,,http://arxiv.org/abs/1103.2760v1,http://arxiv.org/pdf/1103.2760v1,,"4 pages, 4 figures",,,cond-mat.soft,cond-mat.soft
1107.2038v1,2011-07-11 14:23:33,2011-07-11 14:23:33,Theoretical calculation of the phase behavior of colloidal membranes,"  We formulate a density functional theory that describes the phase behavior of
hard rods and depleting polymers, as realized in recent experiments on
suspensions of \emph{fd} virus and non-adsorbing polymer. The theory predicts
the relative stability of nematic droplets, stacked smectic columns, and a
recently discovered phase of isolated monolayers of rods, or colloidal
membranes. We find that a minimum rod aspect ratio is required for stability of
colloidal membranes and that collective protrusion undulations are the dominant
effect that stabilizes this phase. The theoretical predictions are shown to be
qualitatively consistent with experimental and computational results.
",Yasheng Yang|Michael F. Hagan,,http://arxiv.org/abs/1107.2038v1,http://arxiv.org/pdf/1107.2038v1,http://dx.doi.org/10.1103/PhysRevE.84.051402,"9.1 pages, 7 figures",,10.1103/PhysRevE.84.051402,cond-mat.soft,cond-mat.soft
1403.6804v1,2014-03-26 19:27:34,2014-03-26 19:27:34,"A simple modification for improving inference of non-linear dynamical
  systems","  Particle and ensemble filters are increasingly utilized for inference,
optimization, and forecast; however, both filtering methods use discrete
distributions to simulate continuous state space, a drawback that can lead to
degraded performance for non-linear dynamical systems. Here we propose a simple
modification, applicable to both particle and ensemble filters, that
compensates for this problem. The method randomly replaces one or more model
variables or parameters within a fraction of simulated trajectories at each
filtering cycle. This modification, termed space re-probing, expands the state
space covered by the filter through the introduction of outlying trajectories.
We apply the space re-probing modification to three particle filters and three
ensemble filters, and use these modified filters to model and forecast
influenza epidemics. For both filter types, the space re-probing improves
simulation of influenza epidemic curves and the prediction of influenza
outbreak peak timing. Further, as fewer particles are needed for the particle
filters, the proposed modification reduces the computational cost of these
filters.
",Wan Yang|Jeffrey Shaman,,http://arxiv.org/abs/1403.6804v1,http://arxiv.org/pdf/1403.6804v1,,,,,stat.ME,stat.ME
1407.7913v3,2014-07-30 01:04:18,2015-01-13 17:20:31,"Spatiotemporal clustering, climate periodicity, and social-ecological
  risk factors for dengue during an outbreak in Machala, Ecuador, in 2010","  The objective of this study was to characterize the spatiotemporal dynamics
and climatic and social-ecological risk factors associated with the largest
dengue epidemic to date in Machala, Ecuador, to inform the development of a
dengue EWS. The following data were included in analyses: neighborhood-level
georeferenced dengue cases, national census data, and entomological
surveillance data from 2010; time series of weekly dengue cases (aggregated to
the city-level) and meteorological data from 2003 to 2012. We applied LISA and
Morans I to analyze the spatial distribution of the 2010 dengue cases, and
developed multivariate logistic regression models through a multi-model
selection process to identify census variables and entomological covariates
associated with the presence of dengue at the neighborhood level. Using data
aggregated at the city-level, we conducted a time-series (wavelet) analysis of
weekly climate and dengue incidence (2003-2012) to identify significant time
periods (e.g., annual, biannual) when climate co-varied with dengue, and to
describe the climate conditions associated with the 2010 outbreak. We found
significant hotspots of dengue transmission near the center of Machala. The
best-fit model to predict the presence of dengue included older age and female
gender of the head of the household, greater access to piped water in the home,
poor housing condition, and less distance to the central hospital. Wavelet
analyses revealed that dengue transmission co-varied with rainfall and minimum
temperature at annual and biannual cycles, and we found that anomalously high
rainfall and temperatures were associated with the 2010 outbreak. Our findings
highlight the importance of geospatial information in dengue surveillance and
the potential to develop a climate-driven spatiotemporal prediction models to
inform disease prevention and control interventions.
",Anna M. Stewart Ibarra|Angel G. Munoz|Sadie J. Ryan|Mercy J. Borbor|Efrain Beltran Ayala|Julia L. Finkelstein|Raul Mejia|Tania Ordonez|G. Cristina Recalde Coronel|Keytia Rivero,,http://arxiv.org/abs/1407.7913v3,http://arxiv.org/pdf/1407.7913v3,http://dx.doi.org/10.1186/s12879-014-0610-4,"Available at BMC Infectious Diseases:
  http://www.biomedcentral.com/1471-2334/14/610",2014. BMC Infectious Disease. 14:610,10.1186/s12879-014-0610-4,q-bio.PE,q-bio.PE
1410.8564v1,2014-10-30 21:29:17,2014-10-30 21:29:17,Ebola cases and health system demand in Liberia,"  In 2014, a major epidemic of human Ebola virus disease emerged in West
Africa, where human-to-human transmission has now been been sustained for
greater than 10 months. In the summer of 2014, there was great uncertainty
about the answers to several key policy questions concerning the path to
containment. In recent years, epidemic models have been used to guide public
health interventions. But, model-based policy relies on high quality causal
understanding of transmission, including the availability of appropriate
dynamic transmission models and reliable reporting about the sequence of case
incidence for model fitting, which were lacking for this epidemic. To
investigate the range of potential transmission scenarios, we developed a
multi-type branching process model that incorporates key heterogeneities and
time-varying parameters to reflect changing human behavior and deliberate
interventions. Ensembles of this model were evaluated at a set of parameters
that were both epidemiologically plausible and capable of reproducing the
observed trajectory. Results suggest that epidemic outcome depends on both
hospital capacity and individual behavior. The model predicts that if hospital
capacity is not increased soon, then transmission may outpace the rate of
isolation and the ability to provide care for the ill, infectious, and dying.
Similarly, containment will probably require individuals to adopt behaviors
that increase the rates of case identification and isolation and secure burial
of the deceased. Given current knowledge, it is uncertain that this epidemic
will be contained even with 99% hospitalization rate at the currently projected
hospital capacity.
",John M. Drake|RajReni B. Kaul|Laura Alexander|Suzanne M. O'Regan|Andrew M. Kramer|J. Tomlin Pulliam|Matthew J. Ferrari|Andrew W. Park,,http://arxiv.org/abs/1410.8564v1,http://arxiv.org/pdf/1410.8564v1,,Includes supplement,,,q-bio.PE,q-bio.PE
1508.05590v1,2015-08-23 10:13:20,2015-08-23 10:13:20,Emergence of coexisting percolating clusters in networks,"  It is commonly assumed in percolation theories that at most one percolating
cluster can exist in a network. We introduce sausage-like networks (SLNs), an
ensemble of synthetic modular networks in which more than one percolating
cluster can appear. We show that coexisting percolating clusters (CPCs) emerge
in such networks due to limited mixing, i.e., a small number of interlinks
between pairs of modules. We develop an approach called modular message passing
(MMP) to describe and verify these observations. We demonstrate that the
appearance of CPCs is an important source of inaccuracy in the previously
introduced percolation theories, such as the message passing (MP) approach.
Moreover, we show that the MMP theory improves significantly over the
predictions of MP for percolation on synthetic networks with limited mixing and
also on several real-world networks. These findings have important implications
for understanding the robustness of networks and in quantifying epidemic
outbreaks in the susceptible-infected-recovered (SIR) model of disease spread.
",Ali Faqeeh|Sergey Melnik|Pol Colomer-de-Simón|James P. Gleeson,,http://arxiv.org/abs/1508.05590v1,http://arxiv.org/pdf/1508.05590v1,http://dx.doi.org/10.1103/PhysRevE.93.062308,"5 pages, 3 figures","Phys. Rev. E 93, 062308 (2016)",10.1103/PhysRevE.93.062308,cond-mat.dis-nn,cond-mat.dis-nn|cond-mat.stat-mech|physics.soc-ph
1508.06941v1,2015-08-27 17:10:18,2015-08-27 17:10:18,"Combining Search, Social Media, and Traditional Data Sources to Improve
  Influenza Surveillance","  We present a machine learning-based methodology capable of providing
real-time (""nowcast"") and forecast estimates of influenza activity in the US by
leveraging data from multiple data sources including: Google searches, Twitter
microblogs, nearly real-time hospital visit records, and data from a
participatory surveillance system. Our main contribution consists of combining
multiple influenza-like illnesses (ILI) activity estimates, generated
independently with each data source, into a single prediction of ILI utilizing
machine learning ensemble approaches. Our methodology exploits the information
in each data source and produces accurate weekly ILI predictions for up to four
weeks ahead of the release of CDC's ILI reports. We evaluate the predictive
ability of our ensemble approach during the 2013-2014 (retrospective) and
2014-2015 (live) flu seasons for each of the four weekly time horizons. Our
ensemble approach demonstrates several advantages: (1) our ensemble method's
predictions outperform every prediction using each data source independently,
(2) our methodology can produce predictions one week ahead of GFT's real-time
estimates with comparable accuracy, and (3) our two and three week forecast
estimates have comparable accuracy to real-time predictions using an
autoregressive model. Moreover, our results show that considerable insight is
gained from incorporating disparate data streams, in the form of social media
and crowd sourced data, into influenza predictions in all time horizons
",Mauricio Santillana|Andre T. Nguyen|Mark Dredze|Michael J. Paul|John S. Brownstein,,http://arxiv.org/abs/1508.06941v1,http://arxiv.org/pdf/1508.06941v1,http://dx.doi.org/10.1371/journal.pcbi.1004513,,,10.1371/journal.pcbi.1004513,stat.AP,stat.AP
1512.01435v1,2015-11-25 11:18:08,2015-11-25 11:18:08,"Generation and analysis of networks with a prescribed degree sequence
  and subgraph family: Higher-order structure matters","  Designing algorithms that generate networks with a given degree sequence
while varying both subgraph composition and distribution of subgraphs around
nodes is an important but challenging research problem. Current algorithms lack
control of key network parameters, the ability to specify to what subgraphs a
node belongs to, come at a considerable complexity cost or, critically, sample
from a limited ensemble of networks. To enable controlled investigations of the
impact and role of subgraphs, especially for epidemics, neuronal activity or
complex contagion, it is essential that the generation process be versatile and
the generated networks as diverse as possible. In this paper, we present two
new network generation algorithms that use subgraphs as building blocks to
construct networks preserving a given degree sequence. Additionally, these
algorithms provide control over clustering both at node and global level. In
both cases, we show that, despite being constrained by a degree sequence and
global clustering, generated networks have markedly different topologies as
evidenced by both subgraph prevalence and distribution around nodes, and
large-scale network structure metrics such as path length and betweenness
measures. Simulations of standard epidemic and complex contagion models on
those networks reveal that degree distribution and global clustering do not
always accurately predict the outcome of dynamical processes taking place on
them. We conclude by discussing the benefits and limitations of both methods.
",Martin Ritchie|Luc Berthouze|Istvan Z Kiss,,http://arxiv.org/abs/1512.01435v1,http://arxiv.org/pdf/1512.01435v1,,"30 pages, 11 figures, Matlab source code available from GitHub",,,physics.soc-ph,physics.soc-ph|cs.SI|q-bio.PE
1610.00638v1,2016-10-03 17:11:03,2016-10-03 17:11:03,"Uncertainty Quantified Computational Analysis of the Energetics of Virus
  Capsid Assembly","  Most of the existing research in assembly pathway prediction/analysis of
virus cap- sids makes the simplifying assumption that the configuration of the
intermediate states can be extracted directly from the final configuration of
the entire capsid. This assump- tion does not take into account the
conformational changes of the constituent proteins as well as minor changes to
the binding interfaces that continues throughout the assembly process until
stabilization. This paper presents a statistical-ensemble based approach which
provides sufficient samples of the configurational space for each monomer and
the relative local orientation between monomers, to capture the uncertainties
in their binding and conformations. Furthermore, instead of using larger
capsomers (trimers, pentamers) as building blocks, we allow all possible
sub-assemblies to bind in all pos- sible combinations. We represent this
assembly graph in two different ways. First, we use the Wilcoxon signed rank
measure to compare the distributions of binding free energy computed on the
sampled conformations to predict likely pathways. Second, we represent chemical
equilibrium aspects of the transitions as a Bayesian Factor graph where both
associations and dissociations are modeled based on concentrations and the
binding free energies. Results from both of these experiments showed
significant departure from those one would obtain if only the static
configurations of the proteins were considered. Hence, we establish the
importance of an uncertainty-aware protocol for pathway analysis, and provide a
statistical framework as an important first step towards assembly pathway
prediction with high statistical confidence.
",Nathan L Clement|Muhibur Rasheed|Chandrajit L Bajaj,,http://arxiv.org/abs/1610.00638v1,http://arxiv.org/pdf/1610.00638v1,,"47 pages, 24 figures",,,q-bio.QM,q-bio.QM|q-bio.BM
1611.06618v1,2016-11-21 00:38:23,2016-11-21 00:38:23,"3D Reconstruction of Heterogeneous Virus Particles with Statistical
  Geometric Symmetry","  In 3-D reconstruction problems, the image data obtained from cryo electron
microscopy is the projection of many heterogeneous instances of the object
under study (e.g., a virus). When the object is heterogeneous but has an
overall symmetry, it is natural to describe the object as stochastic with
symmetrical statistics. This paper presents a maximum likelihood reconstruction
approach which allows each object to lack symmetry while constraining the {\it
statistics} of the ensemble of objects to have symmetry. This algorithm is
demonstrated on bacteriophage HK97 and is contrasted with an existing algorithm
in which each object, while still heterogeneous, has the symmetry.
Reconstruction results show that the proposed algorithm eliminates
long-standing distortions in previous heterogeneity calculations associated
with symmetry axes, and provides estimates that make more biologically sense
than the estimates of existing algorithms.
",Nan Xu|Peter C. Doershuck,,http://arxiv.org/abs/1611.06618v1,http://arxiv.org/pdf/1611.06618v1,,,,,q-bio.QM,q-bio.QM|q-bio.BM
1612.03278v1,2016-12-10 11:00:36,2016-12-10 11:00:36,"Improved prediction accuracy for disease risk mapping using Gaussian
  Process stacked generalisation","  Maps of infectious disease---charting spatial variations in the force of
infection, degree of endemicity, and the burden on human health---provide an
essential evidence base to support planning towards global health targets.
Contemporary disease mapping efforts have embraced statistical modelling
approaches to properly acknowledge uncertainties in both the available
measurements and their spatial interpolation. The most common such approach is
that of Gaussian process regression, a mathematical framework comprised of two
components: a mean function harnessing the predictive power of multiple
independent variables, and a covariance function yielding spatio-temporal
shrinkage against residual variation from the mean. Though many techniques have
been developed to improve the flexibility and fitting of the covariance
function, models for the mean function have typically been restricted to simple
linear terms. For infectious diseases, known to be driven by complex
interactions between environmental and socio-economic factors, improved
modelling of the mean function can greatly boost predictive power. Here we
present an ensemble approach based on stacked generalisation that allows for
multiple, non-linear algorithmic mean functions to be jointly embedded within
the Gaussian process framework. We apply this method to mapping Plasmodium
falciparum prevalence data in Sub-Saharan Africa and show that the generalised
ensemble approach markedly out-performs any individual method.
",Samir Bhatt|Ewan Cameron|Seth R Flaxman|Daniel J Weiss|David L Smith|Peter W Gething,,http://arxiv.org/abs/1612.03278v1,http://arxiv.org/pdf/1612.03278v1,,Under Submission,,,stat.AP,stat.AP|stat.ML
1703.10936v1,2017-03-31 15:13:54,2017-03-31 15:13:54,"Prediction of infectious disease epidemics via weighted density
  ensembles","  Accurate and reliable predictions of infectious disease dynamics can be
valuable to public health organizations that plan interventions to decrease or
prevent disease transmission. A great variety of models have been developed for
this task, using different model structures, covariates, and targets for
prediction. Experience has shown that the performance of these models varies;
some tend to do better or worse in different seasons or at different points
within a season. Ensemble methods combine multiple models to obtain a single
prediction that leverages the strengths of each model. We considered a range of
ensemble methods that each form a predictive density for a target of interest
as a weighted sum of the predictive densities from component models. In the
simplest case, equal weight is assigned to each component model; in the most
complex case, the weights vary with the region, prediction target, week of the
season when the predictions are made, a measure of component model uncertainty,
and recent observations of disease incidence. We applied these methods to
predict measures of influenza season timing and severity in the United States,
both at the national and regional levels, using three component models. We
trained the models on retrospective predictions from 14 seasons (1997/1998 -
2010/2011) and evaluated each model's prospective, out-of-sample performance in
the five subsequent influenza seasons. In this test phase, the ensemble methods
showed overall performance that was similar to the best of the component
models, but offered more consistent performance across seasons than the
component models. Ensemble methods offer the potential to deliver more reliable
predictions to public health decision makers.
",Evan L. Ray|Nicholas G. Reich,,http://arxiv.org/abs/1703.10936v1,http://arxiv.org/pdf/1703.10936v1,http://dx.doi.org/10.1371/journal.pcbi.1005910,"20 pages, 6 figures",,10.1371/journal.pcbi.1005910,stat.ML,stat.ML
1708.03513v3,2017-08-11 12:11:23,2018-06-18 17:54:01,Early Stage Malware Prediction Using Recurrent Neural Networks,"  Static malware analysis is well-suited to endpoint anti-virus systems as it
can be conducted quickly by examining the features of an executable piece of
code and matching it to previously observed malicious code. However, static
code analysis can be vulnerable to code obfuscation techniques. Behavioural
data collected during file execution is more difficult to obfuscate, but takes
a relatively long time to capture - typically up to 5 minutes, meaning the
malicious payload has likely already been delivered by the time it is detected.
  In this paper we investigate the possibility of predicting whether or not an
executable is malicious based on a short snapshot of behavioural data. We find
that an ensemble of recurrent neural networks are able to predict whether an
executable is malicious or benign within the first 5 seconds of execution with
94% accuracy. This is the first time general types of malicious file have been
predicted to be malicious during execution rather than using a complete
activity log file post-execution, and enables cyber security endpoint
protection to be advanced to use behavioural data for blocking malicious
payloads rather than detecting them post-execution and having to repair the
damage.
",Matilda Rhode|Pete Burnap|Kevin Jones,,http://arxiv.org/abs/1708.03513v3,http://arxiv.org/pdf/1708.03513v3,http://dx.doi.org/10.1016/j.cose.2018.05.010,,"Computers & Security, Volume 77, August 2018, Pages 578-594",10.1016/j.cose.2018.05.010,cs.CR,cs.CR
