id,submitted,updated,title,abstract,authors,affiliations,link_abstract,link_pdf,link_doi,comment,journal_ref,doi,primary_category,categories
2304.09947v1,2023-03-30 02:25:54,2023-03-30 02:25:54,"Online Ensemble of Models for Optimal Predictive Performance with
  Applications to Sector Rotation Strategy","  Asset-specific factors are commonly used to forecast financial returns and
quantify asset-specific risk premia. Using various machine learning models, we
demonstrate that the information contained in these factors leads to even
larger economic gains in terms of forecasts of sector returns and the
measurement of sector-specific risk premia. To capitalize on the strong
predictive results of individual models for the performance of different
sectors, we develop a novel online ensemble algorithm that learns to optimize
predictive performance. The algorithm continuously adapts over time to
determine the optimal combination of individual models by solely analyzing
their most recent prediction performance. This makes it particularly suited for
time series problems, rolling window backtesting procedures, and systems of
potentially black-box models. We derive the optimal gain function, express the
corresponding regret bounds in terms of the out-of-sample R-squared measure,
and derive optimal learning rate for the algorithm. Empirically, the new
ensemble outperforms both individual machine learning models and their simple
averages in providing better measurements of sector risk premia. Moreover, it
allows for performance attribution of different factors across various sectors,
without conditioning on a specific model. Finally, by utilizing monthly
predictions from our ensemble, we develop a sector rotation strategy that
significantly outperforms the market. The strategy remains robust against
various financial factors, periods of financial distress, and conservative
transaction costs. Notably, the strategy's efficacy persists over time,
exhibiting consistent improvement throughout an extended backtesting period and
yielding substantial profits during the economic turbulence of the COVID-19
pandemic.
",Jiaju Miao|Pawel Polak,,http://arxiv.org/abs/2304.09947v1,http://arxiv.org/pdf/2304.09947v1,,,,,q-fin.ST,q-fin.ST|cs.LG|stat.ML
2304.06538v2,2023-04-13 13:49:15,2023-07-24 15:22:36,Statistical Mechanics of Inference in Epidemic Spreading,"  We investigate the information-theoretical limits of inference tasks in
epidemic spreading on graphs in the thermodynamic limit. The typical inference
tasks consist in computing observables of the posterior distribution of the
epidemic model given observations taken from a ground truth (sometimes called
planted) random trajectory. We can identify two main sources of quenched
disorder: the graph ensemble and the planted trajectory. The epidemic dynamics
however induces non-trivial long-range correlations among individuals' states
on the latter. This results in non-local correlated quenched disorder which
unfortunately is typically hard to handle. To overcome this difficulty, we
divide the dynamical process into two sets of variables: a set of stochastic
independent variables (representing transmission delays), plus a set of
correlated variables (the infection times) that depend deterministically on the
first. Treating the former as quenched variables and the latter as dynamic
ones, computing disorder average becomes feasible by means of the Replica
Symmetric cavity method. We give theoretical predictions on the posterior
probability distribution of the trajectory of each individual, conditioned to
observations on the state of individuals at given times, focusing on the
Susceptible Infectious (SI) model. In the Bayes-optimal condition, i.e. when
true dynamic parameters are known, the inference task is expected to fall in
the Replica Symmetric regime. We indeed provide predictions for the information
theoretic limits of various inference tasks, in form of phase diagrams. We also
identify a region, in the Bayes-Optimal setting, with strong hints of Replica
Symmetry Breaking. When true parameters are unknown, we show how a
maximum-likelihood procedure is able to recover them with mostly unaffected
performance.
",Alfredo Braunstein|Louise Budzynski|Matteo Mariani,,http://arxiv.org/abs/2304.06538v2,http://arxiv.org/pdf/2304.06538v2,http://dx.doi.org/10.1103/PhysRevE.108.064302,,,10.1103/PhysRevE.108.064302,physics.soc-ph,physics.soc-ph|cond-mat.stat-mech
2304.13135v1,2023-04-25 20:26:05,2023-04-25 20:26:05,MEDNC: Multi-ensemble deep neural network for COVID-19 diagnosis,"  Coronavirus disease 2019 (COVID-19) has spread all over the world for three
years, but medical facilities in many areas still aren't adequate. There is a
need for rapid COVID-19 diagnosis to identify high-risk patients and maximize
the use of limited medical resources. Motivated by this fact, we proposed the
deep learning framework MEDNC for automatic prediction and diagnosis of
COVID-19 using computed tomography (CT) images. Our model was trained using two
publicly available sets of COVID-19 data. And it was built with the inspiration
of transfer learning. Results indicated that the MEDNC greatly enhanced the
detection of COVID-19 infections, reaching an accuracy of 98.79% and 99.82%
respectively. We tested MEDNC on a brain tumor and a blood cell dataset to show
that our model applies to a wide range of problems. The outcomes demonstrated
that our proposed models attained an accuracy of 99.39% and 99.28%,
respectively. This COVID-19 recognition tool could help optimize healthcare
resources and reduce clinicians' workload when screening for the virus.
",Lin Yang|Shuihua Wang|Yudong Zhang,,http://arxiv.org/abs/2304.13135v1,http://arxiv.org/pdf/2304.13135v1,,,,,eess.IV,eess.IV|cs.CV|cs.LG
2305.08660v1,2023-05-15 14:07:22,2023-05-15 14:07:22,Towards Automated COVID-19 Presence and Severity Classification,"  COVID-19 presence classification and severity prediction via (3D) thorax
computed tomography scans have become important tasks in recent times.
Especially for capacity planning of intensive care units, predicting the future
severity of a COVID-19 patient is crucial. The presented approach follows
state-of-theart techniques to aid medical professionals in these situations. It
comprises an ensemble learning strategy via 5-fold cross-validation that
includes transfer learning and combines pre-trained 3D-versions of ResNet34 and
DenseNet121 for COVID19 classification and severity prediction respectively.
Further, domain-specific preprocessing was applied to optimize model
performance. In addition, medical information like the infection-lung-ratio,
patient age, and sex were included. The presented model achieves an AUC of
79.0% to predict COVID-19 severity, and 83.7% AUC to classify the presence of
an infection, which is comparable with other currently popular methods. This
approach is implemented using the AUCMEDI framework and relies on well-known
network architectures to ensure robustness and reproducibility.
",Dominik Müller|Niklas Schröter|Silvan Mertes|Fabio Hellmann|Miriam Elia|Wolfgang Reif|Bernhard Bauer|Elisabeth André|Frank Kramer,,http://arxiv.org/abs/2305.08660v1,http://arxiv.org/pdf/2305.08660v1,,,,,eess.IV,eess.IV|cs.CV
2305.10115v1,2023-05-17 10:43:15,2023-05-17 10:43:15,"An Ensemble Deep Learning Approach for COVID-19 Severity Prediction
  Using Chest CT Scans","  Chest X-rays have been widely used for COVID-19 screening; however, 3D
computed tomography (CT) is a more effective modality. We present our findings
on COVID-19 severity prediction from chest CT scans using the STOIC dataset. We
developed an ensemble deep learning based model that incorporates multiple
neural networks to improve predictions. To address data imbalance, we used
slicing functions and data augmentation. We further improved performance using
test time data augmentation. Our approach which employs a simple yet effective
ensemble of deep learning-based models with strong test time augmentations,
achieved results comparable to more complex methods and secured the fourth
position in the STOIC2021 COVID-19 AI Challenge. Our code is available on
online: at: https://github.com/aleemsidra/stoic2021- baseline-finalphase-main.
",Sidra Aleem|Mayug Maniparambil|Suzanne Little|Noel O'Connor|Kevin McGuinness,,http://arxiv.org/abs/2305.10115v1,http://arxiv.org/pdf/2305.10115v1,,,,,eess.IV,eess.IV|cs.CV|cs.LG
2305.16735v2,2023-05-26 08:38:44,2025-02-24 00:30:25,Angular Combining of Forecasts of Probability Distributions,"  When multiple forecasts are available for a probability distribution,
forecast combining enables a pragmatic synthesis of the information to extract
the wisdom of the crowd. The linear opinion pool has been widely used, whereby
the combining is applied to the probabilities of the distributional forecasts.
However, it has been argued that this will tend to deliver overdispersed
distributions, prompting the combination to be applied, instead, to the
quantiles of the distributional forecasts. Results from different applications
are mixed, leaving it as an empirical question whether to combine probabilities
or quantiles. In this paper, we present an alternative approach. Looking at the
distributional forecasts, combining the probabilities can be viewed as vertical
combining, with quantile combining seen as horizontal combining. Our proposal
is to allow combining to take place on an angle between the extreme cases of
vertical and horizontal combining. We term this angular combining. The angle is
a parameter that can be optimized using a proper scoring rule. For
implementation, we provide a pragmatic numerical approach and a simulation
algorithm. Among our theoretical results, we show that, as with vertical and
horizontal averaging, angular averaging results in a distribution with mean
equal to the average of the means of the distributions that are being combined.
We also show that angular averaging produces a distribution with lower variance
than vertical averaging, and, under certain assumptions, greater variance than
horizontal averaging. We provide empirical results for distributional forecasts
of Covid mortality, macroeconomic survey data, and electricity prices.
",James W. Taylor|Xiaochun Meng,,http://arxiv.org/abs/2305.16735v2,http://arxiv.org/pdf/2305.16735v2,,,,,stat.ME,stat.ME|stat.AP|90B50
2306.05762v3,2023-06-09 08:56:03,2023-08-16 09:02:50,"Real-time COVID-19 hospital admissions forecasting with leading
  indicators and ensemble methods in England","  Hospitalisations from COVID-19 with Omicron sub-lineages have put a sustained
pressure on the English healthcare system. Understanding the expected
healthcare demand enables more effective and timely planning from public
health. We collect syndromic surveillance sources, which include online search
data, NHS 111 telephonic and online triages. Incorporating this data we explore
generalised additive models, generalised linear mixed-models, penalised
generalised linear models and model ensemble methods to forecast over a
two-week forecast horizon at an NHS Trust level. Furthermore, we showcase how
model combinations improve forecast scoring through a mean ensemble, weighted
ensemble, and ensemble by regression. Validated over multiple Omicron waves, at
different spatial scales, we show that leading indicators can improve
performance of forecasting models, particularly at epidemic changepoints. Using
a variety of scoring rules, we show that ensemble approaches outperformed all
individual models, providing higher performance at a 21-day window than the
corresponding individual models at 14-days. We introduce a modelling structure
used by public health officials in England in 2022 to inform NHS healthcare
strategy and policy decision making. This paper explores the significance of
ensemble methods to improve forecasting performance and how novel syndromic
surveillance can be practically applied in epidemic forecasting.
",Jonathon Mellor|Rachel Christie|Robert S Paton|Rhianna Leslie|Maria Tang|Martyn Fyles|Sarah Deeny|Thomas Ward|Christopher E Overton,,http://arxiv.org/abs/2306.05762v3,http://arxiv.org/pdf/2306.05762v3,,arXiv admin note: substantial text overlap with arXiv:2303.12037,,,stat.AP,stat.AP
2306.07935v1,2023-06-11 02:35:48,2023-06-11 02:35:48,Multi-modal Representation Learning for Social Post Location Inference,"  Inferring geographic locations via social posts is essential for many
practical location-based applications such as product marketing,
point-of-interest recommendation, and infector tracking for COVID-19. Unlike
image-based location retrieval or social-post text embedding-based location
inference, the combined effect of multi-modal information (i.e., post images,
text, and hashtags) for social post positioning receives less attention. In
this work, we collect real datasets of social posts with images, texts, and
hashtags from Instagram and propose a novel Multi-modal Representation Learning
Framework (MRLF) capable of fusing different modalities of social posts for
location inference. MRLF integrates a multi-head attention mechanism to enhance
location-salient information extraction while significantly improving location
inference compared with single domain-based methods. To overcome the noisy
user-generated textual content, we introduce a novel attention-based
character-aware module that considers the relative dependencies between
characters of social post texts and hashtags for flexible multi-model
information fusion. The experimental results show that MRLF can make accurate
location predictions and open a new door to understanding the multi-modal data
of social posts for online inference tasks.
",Ruiting Dai|Jiayi Luo|Xucheng Luo|Lisi Mo|Wanlun Ma|Fan Zhou,,http://arxiv.org/abs/2306.07935v1,http://arxiv.org/pdf/2306.07935v1,,"6 pages, 2023 International Conference on Communications",,,cs.CL,cs.CL|cs.AI|cs.LG
2306.13456v1,2023-06-23 11:54:38,2023-06-23 11:54:38,"Enhanced Dengue Outbreak Prediction in Tamilnadu using Meteorological
  and Entomological data","  This paper focuses on studying the impact of climate data and vector larval
indices on dengue outbreak. After a comparative study of the various LSTM
models, Bidirectional Stacked LSTM network is selected to analyze the time
series climate data and health data collected for the state of Tamil Nadu
(India), for the period 2014 to 2020. Prediction accuracy of the model is
significantly improved by including the mosquito larval index, an indication of
VBD control measure.
",Varalakshmi M|Daphne Lopez,"VIT Vellore, India|VIT Vellore, India",http://arxiv.org/abs/2306.13456v1,http://arxiv.org/pdf/2306.13456v1,,"6 Pages and submitted to ICAI'22 - The 24th International Conference
  on Artificial Intelligence",,,cs.LG,cs.LG
2307.01157v1,2023-07-03 17:05:29,2023-07-03 17:05:29,"A novel approach for predicting epidemiological forecasting parameters
  based on real-time signals and Data Assimilation","  This paper proposes a novel approach to predict epidemiological parameters by
integrating new real-time signals from various sources of information, such as
novel social media-based population density maps and Air Quality data. We
implement an ensemble of Convolutional Neural Networks (CNN) models using
various data sources and fusion methodology to build robust predictions and
simulate several dynamic parameters that could improve the decision-making
process for policymakers. Additionally, we used data assimilation to estimate
the state of our system from fused CNN predictions. The combination of
meteorological signals and social media-based population density maps improved
the performance and flexibility of our prediction of the COVID-19 outbreak in
London. While the proposed approach outperforms standard models, such as
compartmental models traditionally used in disease forecasting (SEIR),
generating robust and consistent predictions allows us to increase the
stability of our model while increasing its accuracy.
",Romain Molinas|César Quilodrán Casas|Rossella Arcucci|Ovidiu Şerban,,http://arxiv.org/abs/2307.01157v1,http://arxiv.org/pdf/2307.01157v1,,,,,cs.LG,cs.LG|cs.NE|cs.SI
2307.08853v1,2023-07-17 21:25:00,2023-07-17 21:25:00,"Comparative Analysis of Machine Learning, Hybrid, and Deep Learning
  Forecasting Models Evidence from European Financial Markets and Bitcoins","  This study analyzes the transmission of market uncertainty on key European
financial markets and the cryptocurrency market over an extended period,
encompassing the pre, during, and post-pandemic periods. Daily financial market
indices and price observations are used to assess the forecasting models. We
compare statistical, machine learning, and deep learning forecasting models to
evaluate the financial markets, such as the ARIMA, hybrid ETS-ANN, and kNN
predictive models. The study results indicate that predicting financial market
fluctuations is challenging, and the accuracy levels are generally low in
several instances. ARIMA and hybrid ETS-ANN models perform better over extended
periods compared to the kNN model, with ARIMA being the best-performing model
in 2018-2021 and the hybrid ETS-ANN model being the best-performing model in
most of the other subperiods. Still, the kNN model outperforms the others in
several periods, depending on the observed accuracy measure. Researchers have
advocated using parametric and non-parametric modeling combinations to generate
better results. In this study, the results suggest that the hybrid ETS-ANN
model is the best-performing model despite its moderate level of accuracy.
Thus, the hybrid ETS-ANN model is a promising financial time series forecasting
approach. The findings offer financial analysts an additional source that can
provide valuable insights for investment decisions.
",Apostolos Ampountolas,,http://arxiv.org/abs/2307.08853v1,http://arxiv.org/pdf/2307.08853v1,http://dx.doi.org/10.3390/forecast5020026,,Forecasting 2023,10.3390/forecast5020026,q-fin.ST,q-fin.ST|econ.EM|q-fin.RM
2307.16895v1,2023-07-31 17:59:16,2023-07-31 17:59:16,Conformal PID Control for Time Series Prediction,"  We study the problem of uncertainty quantification for time series
prediction, with the goal of providing easy-to-use algorithms with formal
guarantees. The algorithms we present build upon ideas from conformal
prediction and control theory, are able to prospectively model conformal scores
in an online setting, and adapt to the presence of systematic errors due to
seasonality, trends, and general distribution shifts. Our theory both
simplifies and strengthens existing analyses in online conformal prediction.
Experiments on 4-week-ahead forecasting of statewide COVID-19 death counts in
the U.S. show an improvement in coverage over the ensemble forecaster used in
official CDC communications. We also run experiments on predicting electricity
demand, market returns, and temperature using autoregressive, Theta, Prophet,
and Transformer models. We provide an extendable codebase for testing our
methods and for the integration of new algorithms, data sets, and forecasting
rules.
",Anastasios N. Angelopoulos|Emmanuel J. Candes|Ryan J. Tibshirani,,http://arxiv.org/abs/2307.16895v1,http://arxiv.org/pdf/2307.16895v1,,"Code available at
  https://github.com/aangelopoulos/conformal-time-series",,,cs.LG,cs.LG|cs.SY|eess.SY|stat.ME|stat.ML
2308.13176v1,2023-08-25 04:52:54,2023-08-25 04:52:54,"Using Adamic-Adar Index Algorithm to Predict Volunteer Collaboration:
  Less is More","  Social networks exhibit a complex graph-like structure due to the uncertainty
surrounding potential collaborations among participants. Machine learning
algorithms possess generic outstanding performance in multiple real-world
prediction tasks. However, whether machine learning algorithms outperform
specific algorithms designed for graph link prediction remains unknown to us.
To address this issue, the Adamic-Adar Index (AAI), Jaccard Coefficient (JC)
and common neighbour centrality (CNC) as representatives of graph-specific
algorithms were applied to predict potential collaborations, utilizing data
from volunteer activities during the Covid-19 pandemic in Shenzhen city, along
with the classical machine learning algorithms such as random forest, support
vector machine, and gradient boosting as single predictors and components of
ensemble learning. This paper introduces that the AAI algorithm outperformed
the traditional JC and CNC, and other machine learning algorithms in analyzing
graph node attributes for this task.
",Chao Wu|Peng Chen|Baiqiao Yin|Zijuan Lin|Chen Jiang|Di Yu|Changhong Zou|Chunwang Lui,,http://arxiv.org/abs/2308.13176v1,http://arxiv.org/pdf/2308.13176v1,,,,,cs.SI,cs.SI|cs.LG
2308.15251v1,2023-08-29 12:17:05,2023-08-29 12:17:05,"Bayesian ensemble modelling to monitor excess deaths during summer 2022
  in Switzerland","  Switzerland experienced one of the warmest summers during 2022. Extreme heat
has been linked to increased mortality. Monitoring the mortality burden
attributable to extreme heat is crucial to inform policies, such as heat
warnings, and prevent heat-related deaths. In this study, we evaluate excess
mortality during summer 2022, identify vulnerable populations and estimate
temperature thresholds for heat warnings. We use nationwide mortality and
population data in Switzerland during 2011-2022 by age, sex, day and canton. We
develop a Bayesian ensemble modelling approach with dynamic population to
predict expected mortality in summer 2022 and calculate excess by comparing
expected with observed mortality. We account for covariates associated with
mortality such as ambient temperature, national holidays and spatiotemporal
random effects to improve predictions. After accounting for the effect of the
COVID-19 pandemic, we found a 3% (95% credible interval: 0%-6%) excess
mortality during summer 2022. We observed a total of 456 (5-891) excess deaths
during summer 2022 in people older than 80 years. There was weak evidence of
excess mortality in the other age groups. The highest excess mortality was
observed in July (12%: 4%-19%), the hottest month in 2022. We also found that
for heatwaves longer than four days, the minimum excess mortality temperature
threshold in the oldest age group is the 70th percentile of the temperature. To
reduce future summer excess mortality in Switzerland, we propose targeted heat
warnings to older populations and reducing the temperature threshold when
weather forecasts predict periods of extreme heat of four days or longer.
",Garyfallos Konstantinoudis|Anthony Hauser|Julien Riou,,http://arxiv.org/abs/2308.15251v1,http://arxiv.org/pdf/2308.15251v1,,"43 pages, 11 figures, 18 tables",,,stat.AP,stat.AP
2309.07146v1,2023-09-06 19:42:57,2023-09-06 19:42:57,"Transmission matrix parameter estimation of COVID-19 evolution with age
  compartments using ensemble-based data assimilation","  The COVID-19 pandemic and its multiple outbreaks have challenged governments
around the world. Much of the epidemiological modeling was based on
pre-pandemic contact information of the population, which changed drastically
due to governmental health measures, so called non-pharmaceutical interventions
made to reduce transmission of the virus, like social distancing and complete
lockdown. In this work, we evaluate an ensemble-based data assimilation
framework applied to a meta-population model to infer the transmission of the
disease between different population agegroups. We perform a set of idealized
twin-experiments to investigate the performance of different possible
parameterizations of the transmission matrix. These experiments show that it is
not possible to unambiguously estimate all the independent parameters of the
transmission matrix. However, under certain parameterizations, the transmission
matrix in an age-compartmental model can be estimated. These estimated
parameters lead to an increase of forecast accuracy in agegroups compartments
assimilating age-dependent accumulated cases and deaths observed in Argentina
compared to a single-compartment model, and reliable estimations of the
effective reproduction number. The age-dependent data assimilation and
forecasting of virus transmission may be important for an accurate prediction
and diagnosis of health care demand.
",Santiago Rosa|Manuel Pulido|Juan Ruiz|Tadeo Cocucci,,http://arxiv.org/abs/2309.07146v1,http://arxiv.org/pdf/2309.07146v1,,,,,q-bio.PE,q-bio.PE
