id,submitted,updated,title,abstract,authors,affiliations,link_abstract,link_pdf,link_doi,comment,journal_ref,doi,primary_category,categories
2007.05114v2,2020-07-10 00:11:48,2021-07-17 17:57:27,"Analyzing the Effects of Observation Function Selection in Ensemble
  Kalman Filtering for Epidemic Models","  The Ensemble Kalman Filter (EnKF) is a popular sequential data assimilation
method that has been increasingly used for parameter estimation and forecast
prediction in epidemiological studies. The observation function plays a
critical role in the EnKF framework, connecting the unknown system variables
with the observed data. Key differences in observed data and modeling
assumptions have led to the use of different observation functions in the
epidemic modeling literature. In this work, we present a novel computational
analysis demonstrating the effects of observation function selection when using
the EnKF for state and parameter estimation in this setting. In examining the
use of four epidemiologically-inspired observation functions of different forms
in connection with the classic Susceptible-Infectious-Recovered (SIR) model, we
show how incorrect observation modeling assumptions (i.e., fitting incidence
data with a prevalence model, or neglecting under-reporting) can lead to
inaccurate filtering estimates and forecast predictions. Results demonstrate
the importance of choosing an observation function that well interprets the
available data on the corresponding EnKF estimates in several filtering
scenarios, including state estimation with known parameters, and combined state
and parameter estimation with both constant and time-varying parameters.
Numerical experiments further illustrate how modifying the observation noise
covariance matrix in the filter can help to account for uncertainty in the
observation function in certain cases.
",Leah Mitchell|Andrea Arnold,,http://arxiv.org/abs/2007.05114v2,http://arxiv.org/pdf/2007.05114v2,http://dx.doi.org/10.1016/j.mbs.2021.108655,"29 pages, 13 figures. This is the accepted manuscript of an article
  published in Mathematical Biosciences. The published journal article is
  available online at https://doi.org/10.1016/j.mbs.2021.108655",Mathematical Biosciences 339 (2021) 108655,10.1016/j.mbs.2021.108655,stat.ME,stat.ME|q-bio.QM|stat.AP|stat.CO
2007.10800v1,2020-07-18 21:36:31,2020-07-18 21:36:31,"Probabilistic Neighbourhood Component Analysis: Sample Efficient
  Uncertainty Estimation in Deep Learning","  While Deep Neural Networks (DNNs) achieve state-of-the-art accuracy in
various applications, they often fall short in accurately estimating their
predictive uncertainty and, in turn, fail to recognize when these predictions
may be wrong. Several uncertainty-aware models, such as Bayesian Neural Network
(BNNs) and Deep Ensembles have been proposed in the literature for quantifying
predictive uncertainty. However, research in this area has been largely
confined to the big data regime. In this work, we show that the uncertainty
estimation capability of state-of-the-art BNNs and Deep Ensemble models
degrades significantly when the amount of training data is small. To address
the issue of accurate uncertainty estimation in the small-data regime, we
propose a probabilistic generalization of the popular sample-efficient
non-parametric kNN approach. Our approach enables deep kNN classifier to
accurately quantify underlying uncertainties in its prediction. We demonstrate
the usefulness of the proposed approach by achieving superior uncertainty
quantification as compared to state-of-the-art on a real-world application of
COVID-19 diagnosis from chest X-Rays. Our code is available at
https://github.com/ankurmallick/sample-efficient-uq
",Ankur Mallick|Chaitanya Dwivedi|Bhavya Kailkhura|Gauri Joshi|T. Yong-Jin Han,,http://arxiv.org/abs/2007.10800v1,http://arxiv.org/pdf/2007.10800v1,,,,,cs.LG,cs.LG|cs.CV|eess.IV|stat.ML
2007.12261v1,2020-07-21 17:58:58,2020-07-21 17:58:58,"Short-term forecasting COVID-19 cumulative confirmed cases: Perspectives
  for Brazil","  The new Coronavirus (COVID-19) is an emerging disease responsible for
infecting millions of people since the first notification until nowadays.
Developing efficient short-term forecasting models allow knowing the number of
future cases. In this context, it is possible to develop strategic planning in
the public health system to avoid deaths. In this paper, autoregressive
integrated moving average (ARIMA), cubist (CUBIST), random forest (RF), ridge
regression (RIDGE), support vector regression (SVR), and stacking-ensemble
learning are evaluated in the task of time series forecasting with one, three,
and six-days ahead the COVID-19 cumulative confirmed cases in ten Brazilian
states with a high daily incidence. In the stacking learning approach, the
cubist, RF, RIDGE, and SVR models are adopted as base-learners and Gaussian
process (GP) as meta-learner. The models' effectiveness is evaluated based on
the improvement index, mean absolute error, and symmetric mean absolute
percentage error criteria. In most of the cases, the SVR and stacking ensemble
learning reach a better performance regarding adopted criteria than compared
models. In general, the developed models can generate accurate forecasting,
achieving errors in a range of 0.87% - 3.51%, 1.02% - 5.63%, and 0.95% - 6.90%
in one, three, and six-days-ahead, respectively. The ranking of models in all
scenarios is SVR, stacking ensemble learning, ARIMA, CUBIST, RIDGE, and RF
models. The use of evaluated models is recommended to forecasting and monitor
the ongoing growth of COVID-19 cases, once these models can assist the managers
in the decision-making support systems.
",Matheus Henrique Dal Molin Ribeiro|Ramon Gomes da Silva|Viviana Cocco Mariani|Leandro dos Santos Coelho,,http://arxiv.org/abs/2007.12261v1,http://arxiv.org/pdf/2007.12261v1,http://dx.doi.org/10.1016/j.chaos.2020.109853,"17 pages, 5 figures. Published paper. arXiv admin note: substantial
  text overlap with arXiv:2007.10981","Chaos, Solitons & Fractals. 135 (2020) 109853",10.1016/j.chaos.2020.109853,q-bio.PE,q-bio.PE|cs.LG
2007.11993v1,2020-07-21 18:21:29,2020-07-21 18:21:29,"CVR-Net: A deep convolutional neural network for coronavirus recognition
  from chest radiography images","  The novel Coronavirus Disease 2019 (COVID-19) is a global pandemic disease
spreading rapidly around the world. A robust and automatic early recognition of
COVID-19, via auxiliary computer-aided diagnostic tools, is essential for
disease cure and control. The chest radiography images, such as Computed
Tomography (CT) and X-ray, and deep Convolutional Neural Networks (CNNs), can
be a significant and useful material for designing such tools. However,
designing such an automated tool is challenging as a massive number of manually
annotated datasets are not publicly available yet, which is the core
requirement of supervised learning systems. In this article, we propose a
robust CNN-based network, called CVR-Net (Coronavirus Recognition Network), for
the automatic recognition of the coronavirus from CT or X-ray images. The
proposed end-to-end CVR-Net is a multi-scale-multi-encoder ensemble model,
where we have aggregated the outputs from two different encoders and their
different scales to obtain the final prediction probability. We train and test
the proposed CVR-Net on three different datasets, where the images have
collected from different open-source repositories. We compare our proposed
CVR-Net with state-of-the-art methods, which are trained and tested on the same
datasets. We split three datasets into five different tasks, where each task
has a different number of classes, to evaluate the multi-tasking CVR-Net. Our
model achieves an overall F1-score & accuracy of 0.997 & 0.998; 0.963 & 0.964;
0.816 & 0.820; 0.961 & 0.961; and 0.780 & 0.780, respectively, for task-1 to
task-5. As the CVR-Net provides promising results on the small datasets, it can
be an auspicious computer-aided diagnostic tool for the diagnosis of
coronavirus to assist the clinical practitioners and radiologists. Our source
codes and model are publicly available at
https://github.com/kamruleee51/CVR-Net.
",Md. Kamrul Hasan|Md. Ashraful Alam|Md. Toufick E Elahi|Shidhartho Roy|Sifat Redwan Wahid,,http://arxiv.org/abs/2007.11993v1,http://arxiv.org/pdf/2007.11993v1,,31 Pages,,,eess.IV,eess.IV|cs.CV
2008.01769v1,2020-08-04 19:11:51,2020-08-04 19:11:51,FaceOff: Detecting Face Touching with a Wrist-Worn Accelerometer,"  According to the CDC, one key step of preventing oneself from contracting
coronavirus (COVID-19) is to avoid touching eyes, nose, and mouth with unwashed
hands. However, touching one's face is a frequent and spontaneous
behavior---one study observed subjects touching their faces on average 23 times
per hour. Creative solutions have emerged amongst some recent commercial and
hobbyists' projects, yet most either are closed-source or lack validation in
performance. We develop FaceOff---a sensing technique using a commodity
wrist-worn accelerometer to detect face-touching behavior based on the specific
motion pattern of raising one's hand towards the face. We report a survey
(N=20) that elicits different ways people touch their faces, an algorithm that
temporally ensembles data-driven models to recognize when a face touching
behavior occurs and results from a preliminary user testing (N=3 for a total of
about 90 minutes).
",Xiang 'Anthony' Chen,,http://arxiv.org/abs/2008.01769v1,http://arxiv.org/pdf/2008.01769v1,,,,,cs.HC,cs.HC
2008.03280v2,2020-08-06 07:53:28,2021-01-14 07:46:23,"The Generalized OTOC from Supersymmetric Quantum Mechanics: Study of
  Random Fluctuations from Eigenstate Representation of Correlation Functions","  The concept of out-of-time-ordered correlation (OTOC) function is treated as
a very strong theoretical probe of quantum randomness, using which one can
study both chaotic and non-chaotic phenomena in the context of quantum
statistical mechanics. In this paper, we define a general class of OTOC, which
can perfectly capture quantum randomness phenomena in a better way. Further we
demonstrate an equivalent formalism of computation using a general time
independent Hamiltonian having well defined eigenstate representation for
integrable supersymmetric quantum systems. We found that one needs to consider
two new correlators apart from the usual one to have a complete quantum
description. To visualize the impact of the given formalism we consider the two
well known models viz. Harmonic Oscillator and one dimensional potential well
within the framework of supersymmetry. For the Harmonic Oscillator case we
obtain similar periodic time dependence but dissimilar parameter dependences
compared to the results obtained from both micro-canonical and canonical
ensembles in quantum mechanics without supersymmetry. On the other hand, for
one dimensional potential well problem we found significantly different time
scale and the other parameter dependence compared to the results obtained from
non-supersymmetric quantum mechanics. Finally, to establish the consistency of
the prescribed formalism in the classical limit, we demonstrate the phase space
averaged version of the classical version of OTOCs from a model independent
Hamiltonian along with the previously mentioned these well cited models.
",Kaushik Y. Bhagat|Baibhab Bose|Sayantan Choudhury|Satyaki Chowdhury|Rathindra N. Das|Saptarshhi G. Dastider|Nitin Gupta|Archana Maji|Gabriel D. Pasquino|Swaraj Paul,,http://arxiv.org/abs/2008.03280v2,http://arxiv.org/pdf/2008.03280v2,http://dx.doi.org/10.3390/sym13010044,"125 pages, 40 figures, This project is the part of the non-profit
  virtual international research consortium ""Quantum Aspects of Space-Time and
  Matter (QASTM)"", We would like to dedicate this work for the people those who
  are helping us to fight against COVID-19 pandemic across the globe, Final
  published version","Symmetry 13 (2021) no. 1, 44",10.3390/sym13010044,hep-th,hep-th|cond-mat.dis-nn|gr-qc|nlin.CD|quant-ph
2008.07581v1,2020-08-13 15:09:08,2020-08-13 15:09:08,"A Rolling Optimized Nonlinear Grey Bernoulli Model RONGBM(1,1) and
  application in predicting total COVID-19 infected cases","  The Nonlinear Grey Bernoulli Model NGBM(1, 1) is a recently developed grey
model which has various applications in different fields, mainly due to its
accuracy in handling small time-series datasets with nonlinear variations. In
this paper, to fully improve the accuracy of this model, a novel model is
proposed, namely Rolling Optimized Nonlinear Grey Bernoulli Model RONGBM(1, 1).
This model combines the rolling mechanism with the simultaneous optimization of
all model parameters (exponential, background value and initial condition). The
accuracy of this new model has significantly been proven through forecasting
Vietnam's GDP from 2013 to 2018, before it is applied to predict the total
COVID-19 infected cases globally by day.
",Hoang Anh Ngo|Thai Nam HOANG,"École Polytechnique, Palaiseau, France|Beloit College, Wisconsin, United States",http://arxiv.org/abs/2008.07581v1,http://arxiv.org/pdf/2008.07581v1,,"Accepted paper at the 2020 International Congress of Grey Systems and
  Uncertainty Analysis (GSUA)",,,stat.AP,stat.AP|eess.SP|stat.ME|62M10 (Primary) 62P10 (Secondary)
2009.02671v2,2020-09-06 08:24:55,2021-04-01 06:21:07,"BANANA at WNUT-2020 Task 2: Identifying COVID-19 Information on Twitter
  by Combining Deep Learning and Transfer Learning Models","  The outbreak COVID-19 virus caused a significant impact on the health of
people all over the world. Therefore, it is essential to have a piece of
constant and accurate information about the disease with everyone. This paper
describes our prediction system for WNUT-2020 Task 2: Identification of
Informative COVID-19 English Tweets. The dataset for this task contains size
10,000 tweets in English labeled by humans. The ensemble model from our three
transformer and deep learning models is used for the final prediction. The
experimental result indicates that we have achieved F1 for the INFORMATIVE
label on our systems at 88.81% on the test set.
",Tin Van Huynh|Luan Thanh Nguyen|Son T. Luu,,http://arxiv.org/abs/2009.02671v2,http://arxiv.org/pdf/2009.02671v2,http://dx.doi.org/10.18653/v1/2020.wnut-1.50,"Submitted to 2020 The 6th Workshop on Noisy User-generated Text
  (W-NUT)",,10.18653/v1/2020.wnut-1.50,cs.CL,cs.CL|cs.SI
2009.13423v1,2020-09-24 16:42:19,2020-09-24 16:42:19,"Ensemble Forecasting of the Zika Space-TimeSpread with Topological Data
  Analysis","  As per the records of theWorld Health Organization, the first formally
reported incidence of Zika virus occurred in Brazil in May 2015. The disease
then rapidly spread to other countries in Americas and East Asia, affecting
more than 1,000,000 people. Zika virus is primarily transmitted through bites
of infected mosquitoes of the species Aedes (Aedes aegypti and Aedes
albopictus). The abundance of mosquitoes and, as a result, the prevalence of
Zika virus infections are common in areas which have high precipitation, high
temperature, and high population density.Nonlinear spatio-temporal dependency
of such data and lack of historical public health records make prediction of
the virus spread particularly challenging. In this article, we enhance Zika
forecasting by introducing the concepts of topological data analysis and,
specifically, persistent homology of atmospheric variables, into the virus
spread modeling. The topological summaries allow for capturing higher order
dependencies among atmospheric variables that otherwise might be unassessable
via conventional spatio-temporal modeling approaches based on geographical
proximity assessed via Euclidean distance. We introduce a new concept of
cumulative Betti numbers and then integrate the cumulative Betti numbers as
topological descriptors into three predictive machine learning models: random
forest, generalized boosted regression, and deep neural network. Furthermore,
to better quantify for various sources of uncertainties, we combine the
resulting individual model forecasts into an ensemble of the Zika spread
predictions using Bayesian model averaging. The proposed methodology is
illustrated in application to forecasting of the Zika space-time spread in
Brazil in the year 2018.
",Marwah Soliman|Vyacheslav Lyubchich|Yulia R. Gel,,http://arxiv.org/abs/2009.13423v1,http://arxiv.org/pdf/2009.13423v1,,"29 page, 5 figures","Environmetrics, 2020",,q-bio.PE,q-bio.PE|stat.AP|stat.ML
2009.11850v2,2020-09-24 17:53:17,2020-10-16 01:24:48,"ECOVNet: An Ensemble of Deep Convolutional Neural Networks Based on
  EfficientNet to Detect COVID-19 From Chest X-rays","  This paper proposed an ensemble of deep convolutional neural networks (CNN)
based on EfficientNet, named ECOVNet, to detect COVID-19 using a large chest
X-ray data set. At first, the open-access large chest X-ray collection is
augmented, and then ImageNet pre-trained weights for EfficientNet is
transferred with some customized fine-tuning top layers that are trained,
followed by an ensemble of model snapshots to classify chest X-rays
corresponding to COVID-19, normal, and pneumonia. The predictions of the model
snapshots, which are created during a single training, are combined through two
ensemble strategies, i.e., hard ensemble and soft ensemble to ameliorate
classification performance and generalization in the related task of
classifying chest X-rays.
",Nihad Karim Chowdhury|Muhammad Ashad Kabir|Md. Muhtadir Rahman|Noortaz Rezoana,,http://arxiv.org/abs/2009.11850v2,http://arxiv.org/pdf/2009.11850v2,http://dx.doi.org/10.7717/peerj-cs.551,,"Peer J Computer Science, 2021",10.7717/peerj-cs.551,eess.IV,eess.IV|cs.CV
2010.01380v1,2020-10-03 16:14:55,2020-10-03 16:14:55,Predicting traffic overflows on private peering,"  Large content providers and content distribution network operators usually
connect with large Internet service providers (eyeball networks) through
dedicated private peering. The capacity of these private network interconnects
is provisioned to match the volume of the real content demand by the users.
Unfortunately, in case of a surge in traffic demand, for example due to a
content trending in a certain country, the capacity of the private interconnect
may deplete and the content provider/distributor would have to reroute the
excess traffic through transit providers. Although, such overflow events are
rare, they have significant negative impacts on content providers, Internet
service providers, and end-users. These include unexpected delays and
disruptions reducing the user experience quality, as well as direct costs paid
by the Internet service provider to the transit providers. If the traffic
overflow events could be predicted, the Internet service providers would be
able to influence the routes chosen for the excess traffic to reduce the costs
and increase user experience quality. In this article we propose a method based
on an ensemble of deep learning models to predict overflow events over a short
term horizon of 2-6 hours and predict the specific interconnections that will
ingress the overflow traffic. The method was evaluated with 2.5 years' traffic
measurement data from a large European Internet service provider resulting in a
true-positive rate of 0.8 while maintaining a 0.05 false-positive rate. The
lockdown imposed by the COVID-19 pandemic reduced the overflow prediction
accuracy. Nevertheless, starting from the end of April 2020 with the gradual
lockdown release, the old models trained before the pandemic perform equally
well.
",Elad Rapaport|Ingmar Poese|Polina Zilberman|Oliver Holschke|Rami Puzis,,http://arxiv.org/abs/2010.01380v1,http://arxiv.org/pdf/2010.01380v1,,,,,cs.NI,cs.NI|cs.AI|cs.LG
2010.04052v1,2020-10-04 13:34:12,2020-10-04 13:34:12,Ensemble Machine Learning Methods for Modeling COVID19 Deaths,"  Using a hybrid of machine learning and epidemiological approaches, we propose
a novel data-driven approach in predicting US COVID-19 deaths at a county
level. The model gives a more complete description of the daily death
distribution, outputting quantile-estimates instead of mean deaths, where the
model's objective is to minimize the pinball loss on deaths reported by the New
York Times coronavirus county dataset. The resulting quantile estimates
accurately forecast deaths at an individual-county level for a variable-length
forecast period, and the approach generalizes well across different forecast
period lengths. We won the Caltech-run modeling competition out of 50+ teams,
and our aggregate is competitive with the best COVID-19 modeling systems (on
root mean squared error).
",R. Bathwal|P. Chitta|K. Tirumala|V. Varadarajan,,http://arxiv.org/abs/2010.04052v1,http://arxiv.org/pdf/2010.04052v1,,,,,cs.LG,cs.LG|stat.ML
2010.04420v1,2020-10-09 08:10:45,2020-10-09 08:10:45,"Prognosis Prediction in Covid-19 Patients from Lab Tests and X-ray Data
  through Randomized Decision Trees","  AI and Machine Learning can offer powerful tools to help in the fight against
Covid-19. In this paper we present a study and a concrete tool based on machine
learning to predict the prognosis of hospitalised patients with Covid-19. In
particular we address the task of predicting the risk of death of a patient at
different times of the hospitalisation, on the base of some demographic
information, chest X-ray scores and several laboratory findings. Our machine
learning models use ensembles of decision trees trained and tested using data
from more than 2000 patients. An experimental evaluation of the models shows
good performance in solving the addressed task.
",Alfonso Emilio Gerevini|Roberto Maroldi|Matteo Olivato|Luca Putelli|Ivan Serina,,http://arxiv.org/abs/2010.04420v1,http://arxiv.org/pdf/2010.04420v1,,"5th International Workshop on Knowledge Discovery in Healthcare Data
  (KDH) at ECAI 2020, mortality prediction, COVID-19","Proceedings of the 5th International Workshop on Knowledge
  Discovery in Healthcare Data co-located with 24th European Conference on
  Artificial Intelligence (ECAI 2020)",,cs.LG,cs.LG
2010.09095v1,2020-10-18 20:33:59,2020-10-18 20:33:59,"First-principles computation of boron-nitride-based ultrathin UV-C light
  emitting diodes","  Short wavelength ultraviolet (UV-C) light deactivates DNA of any germs,
including multiresistive bacteria and viruses like COVID-19. Two-dimensional
(2D) material-based UV-C light emitting diodes can potentially be integrated
into arbitrary surfaces to allow for shadow-free surface disinfection. In this
work, we perform a series of first-principles calculations to identify the core
components of ultrathin LEDs based on hexagonal boron nitride (hBN). The
electrons and holes are predicted to be confined in multiple quantum wells
(MQWs) by combining hBN layers with different stacking orders. Various p- and
n-doping candidates for hBN are assessed, and the relative p- and n-type metal
contacts with low Schottky barrier heights are identified. The findings are
summarized in a concrete UV-C LED structure proposal.
",Jinying Wang|Kuang-Chung Wang|Tillmann Kubis,,http://arxiv.org/abs/2010.09095v1,http://arxiv.org/pdf/2010.09095v1,,"20 pages, 8 figures",,,physics.app-ph,physics.app-ph|cond-mat.mtrl-sci
2010.14491v2,2020-10-27 17:52:02,2020-11-23 22:46:40,"Examining Deep Learning Models with Multiple Data Sources for COVID-19
  Forecasting","  The COVID-19 pandemic represents the most significant public health disaster
since the 1918 influenza pandemic. During pandemics such as COVID-19, timely
and reliable spatio-temporal forecasting of epidemic dynamics is crucial. Deep
learning-based time series models for forecasting have recently gained
popularity and have been successfully used for epidemic forecasting. Here we
focus on the design and analysis of deep learning-based models for COVID-19
forecasting. We implement multiple recurrent neural network-based deep learning
models and combine them using the stacking ensemble technique. In order to
incorporate the effects of multiple factors in COVID-19 spread, we consider
multiple sources such as COVID-19 confirmed and death case count data and
testing data for better predictions. To overcome the sparsity of training data
and to address the dynamic correlation of the disease, we propose
clustering-based training for high-resolution forecasting. The methods help us
to identify the similar trends of certain groups of regions due to various
spatio-temporal effects. We examine the proposed method for forecasting weekly
COVID-19 new confirmed cases at county-, state-, and country-level. A
comprehensive comparison between different time series models in COVID-19
context is conducted and analyzed. The results show that simple deep learning
models can achieve comparable or better performance when compared with more
complicated models. We are currently integrating our methods as a part of our
weekly forecasts that we provide state and federal authorities.
",Lijing Wang|Aniruddha Adiga|Srinivasan Venkatramanan|Jiangzhuo Chen|Bryan Lewis|Madhav Marathe,,http://arxiv.org/abs/2010.14491v2,http://arxiv.org/pdf/2010.14491v2,,,,,cs.LG,cs.LG|stat.AP
