id,submitted,updated,title,abstract,authors,affiliations,link_abstract,link_pdf,link_doi,comment,journal_ref,doi,primary_category,categories
2107.09891v1,2021-07-21 06:12:22,2021-07-21 06:12:22,On the accuracy of short-term COVID-19 fatality forecasts,"  Forecasting new cases, hospitalizations, and disease-induced deaths is an
important part of infectious disease surveillance and helps guide health
officials in implementing effective countermeasures. For disease surveillance
in the U.S., the Centers for Disease Control and Prevention (CDC) combine more
than 65 individual forecasts of these numbers in an ensemble forecast at
national and state levels. We collected data on CDC ensemble forecasts of
COVID-19 fatalities in the United States, and compare them with easily
interpretable ``Euler'' forecasts serving as a model-free benchmark that is
only based on the local rate of change of the incidence curve. The term ``Euler
method'' is motivated by the eponymous numerical integration scheme that
calculates the value of a function at a future time step based on the current
rate of change. Our results show that CDC ensemble forecasts are not more
accurate than ``Euler'' forecasts on short-term forecasting horizons of one
week. However, CDC ensemble forecasts show a better performance on longer
forecasting horizons. Using the current rate of change in incidences as
estimates of future incidence changes is useful for epidemic forecasting on
short time horizons. An advantage of the proposed method over other forecasting
approaches is that it can be implemented with a very limited amount of work and
without relying on additional data (e.g., human mobility and contact patterns)
and high-performance computing systems.
",Nino Antulov-Fantulin|Lucas Böttcher,,http://arxiv.org/abs/2107.09891v1,http://arxiv.org/pdf/2107.09891v1,http://dx.doi.org/10.1186/s12879-022-07205-9,"4 pages, 1 figure","BMC Infect Dis 22, 251 (2022)",10.1186/s12879-022-07205-9,physics.soc-ph,physics.soc-ph|q-bio.PE
2108.07808v2,2021-08-17 19:00:32,2022-01-21 14:34:30,"Simulating COVID19 Transmission From Observed Movement: An Agent-Based
  Model of Classroom Dispersion","  Current models of COVID-19 transmission predict infection from reported or
assumed interactions. Here we leverage high-resolution observations of
interaction to simulate infectious processes. Ultra-Wide Radio Frequency
Identification (RFID) systems were employed to track the real-time physical
movements and directional orientation of children and their teachers in 4
preschool classes over a total of 34 observations. An agent-based transmission
model combined observed interaction patterns (individual distance and
orientation) with CDC-published risk guidelines to estimate the transmission
impact of an infected patient zero attending class on the proportion of overall
infections, the average transmission rate, and the time lag to the appearance
of symptomatic individuals. These metrics highlighted the prophylactic role of
decreased classroom density and teacher vaccinations. Reduction of classroom
density to half capacity was associated with an 18.2% drop in overall infection
proportion while teacher vaccination receipt was associated with a 25.3%drop.
Simulation results of classroom transmission dynamics may inform public policy
in the face of COVID-19 and similar infectious threats.
",Yi Zhang|Yudong Tao|Mei-Ling Shyu|Lynn K. Perry|Prem R. Warde|Daniel S. Messinger|Chaoming Song,,http://arxiv.org/abs/2108.07808v2,http://arxiv.org/pdf/2108.07808v2,,,,,cs.CY,cs.CY|physics.bio-ph
2108.08723v6,2021-08-19 14:44:46,2021-12-05 08:29:47,"Feature-weighted Stacking for Nonseasonal Time Series Forecasts: A Case
  Study of the COVID-19 Epidemic Curves","  We investigate ensembling techniques in forecasting and examine their
potential for use in nonseasonal time-series similar to those in the early days
of the COVID-19 pandemic. Developing improved forecast methods is essential as
they provide data-driven decisions to organisations and decision-makers during
critical phases. We propose using late data fusion, using a stacked ensemble of
two forecasting models and two meta-features that prove their predictive power
during a preliminary forecasting stage. The final ensembles include a Prophet
and long short term memory (LSTM) neural network as base models. The base
models are combined by a multilayer perceptron (MLP), taking into account
meta-features that indicate the highest correlation with each base model's
forecast accuracy. We further show that the inclusion of meta-features
generally improves the ensemble's forecast accuracy across two forecast
horizons of seven and fourteen days. This research reinforces previous work and
demonstrates the value of combining traditional statistical models with deep
learning models to produce more accurate forecast models for time-series from
different domains and seasonality.
",Pieter Cawood|Terence L. van Zyl,,http://arxiv.org/abs/2108.08723v6,http://arxiv.org/pdf/2108.08723v6,http://dx.doi.org/10.1109/ISCMI53840.2021.9654809,,,10.1109/ISCMI53840.2021.9654809,cs.LG,cs.LG|cs.AI
2108.09131v2,2021-08-20 11:56:15,2023-04-26 12:02:18,"Transfer-Recursive-Ensemble Learning for Multi-Day COVID-19 Prediction
  in India using Recurrent Neural Networks","  The current COVID-19 pandemic has put a huge challenge on the Indian health
infrastructure. With more and more people getting affected during the second
wave, the hospitals were over-burdened, running out of supplies and oxygen. In
this scenario, prediction of the number of COVID-19 cases beforehand might have
helped in the better utilization of limited resources and supplies. This
manuscript deals with the prediction of new COVID-19 cases, new deaths and
total active cases for multiple days in advance. The proposed method uses gated
recurrent unit networks as the main predicting model. A study is conducted by
building four models that are pre-trained on the data from four different
countries (United States of America, Brazil, Spain and Bangladesh) and are
fine-tuned or retrained on India's data. Since the four countries chosen have
experienced different types of infection curves, the pre-training provides a
transfer learning to the models incorporating diverse situations into account.
Each of the four models then give a multiple days ahead predictions using
recursive learning method for the Indian test data. The final prediction comes
from an ensemble of the predictions of the combination of different models.
This method with two countries, Spain and Brazil, is seen to achieve the best
performance amongst all the combinations as well as compared to other
traditional regression models.
",Debasrita Chakraborty|Debayan Goswami|Susmita Ghosh|Ashish Ghosh|Jonathan H. Chan,,http://arxiv.org/abs/2108.09131v2,http://arxiv.org/pdf/2108.09131v2,http://dx.doi.org/10.1038/s41598-023-31737-y,"8 pages, 7 figures","Sci Rep 13, 6795 (2023)",10.1038/s41598-023-31737-y,cs.LG,cs.LG|cs.CY
2108.13823v1,2021-08-31 13:28:51,2021-08-31 13:28:51,"Temporal Deep Learning Architecture for Prediction of COVID-19 Cases in
  India","  To combat the recent coronavirus disease 2019 (COVID-19), academician and
clinician are in search of new approaches to predict the COVID-19 outbreak
dynamic trends that may slow down or stop the pandemic. Epidemiological models
like Susceptible-Infected-Recovered (SIR) and its variants are helpful to
understand the dynamics trend of pandemic that may be used in decision making
to optimize possible controls from the infectious disease. But these
epidemiological models based on mathematical assumptions may not predict the
real pandemic situation. Recently the new machine learning approaches are being
used to understand the dynamic trend of COVID-19 spread. In this paper, we
designed the recurrent and convolutional neural network models: vanilla LSTM,
stacked LSTM, ED-LSTM, Bi-LSTM, CNN, and hybrid CNN+LSTM model to capture the
complex trend of COVID-19 outbreak and perform the forecasting of COVID-19
daily confirmed cases of 7, 14, 21 days for India and its four most affected
states (Maharashtra, Kerala, Karnataka, and Tamil Nadu). The root mean square
error (RMSE) and mean absolute percentage error (MAPE) evaluation metric are
computed on the testing data to demonstrate the relative performance of these
models. The results show that the stacked LSTM and hybrid CNN+LSTM models
perform best relative to other models.
",Hanuman Verma|Saurav Mandal|Akshansh Gupta,,http://arxiv.org/abs/2108.13823v1,http://arxiv.org/pdf/2108.13823v1,,13 pages,,,q-bio.QM,q-bio.QM|cs.LG
2109.01309v1,2021-09-03 04:50:35,2021-09-03 04:50:35,"Unsupervised multi-latent space reinforcement learning framework for
  video summarization in ultrasound imaging","  The COVID-19 pandemic has highlighted the need for a tool to speed up triage
in ultrasound scans and provide clinicians with fast access to relevant
information. The proposed video-summarization technique is a step in this
direction that provides clinicians access to relevant key-frames from a given
ultrasound scan (such as lung ultrasound) while reducing resource, storage and
bandwidth requirements. We propose a new unsupervised reinforcement learning
(RL) framework with novel rewards that facilitates unsupervised learning
avoiding tedious and impractical manual labelling for summarizing ultrasound
videos to enhance its utility as a triage tool in the emergency department (ED)
and for use in telemedicine. Using an attention ensemble of encoders, the high
dimensional image is projected into a low dimensional latent space in terms of:
a) reduced distance with a normal or abnormal class (classifier encoder), b)
following a topology of landmarks (segmentation encoder), and c) the distance
or topology agnostic latent representation (convolutional autoencoders). The
decoder is implemented using a bi-directional long-short term memory (Bi-LSTM)
which utilizes the latent space representation from the encoder. Our new
paradigm for video summarization is capable of delivering classification labels
and segmentation of key landmarks for each of the summarized keyframes.
Validation is performed on lung ultrasound (LUS) dataset, that typically
represent potential use cases in telemedicine and ED triage acquired from
different medical centers across geographies (India, Spain and Canada).
",Roshan P Mathews|Mahesh Raveendranatha Panicker|Abhilash R Hareendranathan|Yale Tung Chen|Jacob L Jaremko|Brian Buchanan|Kiran Vishnu Narayan|Kesavadas C|Greeta Mathews,,http://arxiv.org/abs/2109.01309v1,http://arxiv.org/pdf/2109.01309v1,,"24 pages, submitted to Elsevier Medical Image Analysis for review",,,eess.IV,eess.IV|cs.CV
2109.13063v1,2021-09-19 04:38:13,2021-09-19 04:38:13,"An Automated Multi-Web Platform Voting Framework to Predict Misleading
  Information Proliferated during COVID-19 Outbreak using Ensemble Method","  Spreading of misleading information on social web platforms has fuelled huge
panic and confusion among the public regarding the Corona disease, the
detection of which is of paramount importance. To address this issue, in this
paper, we have developed an automated system that can collect and validate the
fact from multi web-platform to decide the credibility of the content. To
identify the credibility of the posted claim, probable instances/clues(titles)
of news information are first gathered from various web platforms. Later, the
crucial set of features is retrieved that further feeds into the ensemble-based
machine learning model to classify the news as misleading or real. The four
sets of features based on the content, linguistics/semantic cues, similarity,
and sentiments gathered from web-platforms and voting are applied to validate
the news. Finally, the combined voting decides the support given to a specific
claim. In addition to the validation part, a unique source platform is designed
for collecting data/facts from three web platforms (Twitter, Facebook, Google)
based on certain queries/words. This unique platform can also help researchers
build datasets and gather useful/efficient clues from various web platforms. It
has been observed that our proposed intelligent strategy gives promising
results and quite effective in predicting misleading information. The proposed
work provides practical implications for the policy makers and health
practitioners that could be useful in protecting the world from misleading
information proliferation during this pandemic.
",Deepika Varshney|Dinesh Kumar Vishwakarma,,http://arxiv.org/abs/2109.13063v1,http://arxiv.org/pdf/2109.13063v1,,"22 pages, 06 figures",,,cs.IR,cs.IR
2109.09164v2,2021-09-19 16:52:41,2021-10-02 20:41:30,"Optimal Ensemble Construction for Multi-Study Prediction with
  Applications to COVID-19 Excess Mortality Estimation","  It is increasingly common to encounter prediction tasks in the biomedical
sciences for which multiple datasets are available for model training. Common
approaches such as pooling datasets and applying standard statistical learning
methods can result in poor out-of-study prediction performance when datasets
are heterogeneous. Theoretical and applied work has shown $\textit{multi-study
ensembling}$ to be a viable alternative that leverages the variability across
datasets in a manner that promotes model generalizability. Multi-study
ensembling uses a two-stage $\textit{stacking}$ strategy which fits
study-specific models and estimates ensemble weights separately. This approach
ignores, however, the ensemble properties at the model-fitting stage,
potentially resulting in a loss of efficiency. We therefore propose
$\textit{optimal ensemble construction}$, an $\textit{all-in-one}$ approach to
multi-study stacking whereby we jointly estimate ensemble weights as well as
parameters associated with each study-specific model. We prove that limiting
cases of our approach yield existing methods such as multi-study stacking and
pooling datasets before model fitting. We propose an efficient block coordinate
descent algorithm to optimize the proposed loss function. We compare our
approach to standard methods by applying it to a multi-country COVID-19 dataset
for baseline mortality prediction. We show that when little data is available
for a country before the onset of the pandemic, leveraging data from other
countries can substantially improve prediction accuracy. Importantly, our
approach outperforms multi-study stacking and other standard methods in this
application. We further characterize the method's performance in simulations.
Our method remains competitive with or outperforms multi-study stacking and
other earlier methods across a range of between-study heterogeneity levels.
",Gabriel Loewinger|Rolando Acosta Nunez|Rahul Mazumder|Giovanni Parmigiani,,http://arxiv.org/abs/2109.09164v2,http://arxiv.org/pdf/2109.09164v2,,"Manuscript: 27 pages, 6 figures, 4 tables; Supplement: 18 pages, 11
  figures, 10 tables",,,stat.ML,stat.ML|cs.LG
2109.09241v3,2021-09-19 22:32:55,2022-07-28 22:24:48,"Robust Framework for COVID-19 Identification from a Multicenter Dataset
  of Chest CT Scans","  The objective of this study is to develop a robust deep learning-based
framework to distinguish COVID-19, Community-Acquired Pneumonia (CAP), and
Normal cases based on chest CT scans acquired in different imaging centers
using various protocols, and radiation doses. We showed that while our proposed
model is trained on a relatively small dataset acquired from only one imaging
center using a specific scanning protocol, the model performs well on
heterogeneous test sets obtained by multiple scanners using different technical
parameters. We also showed that the model can be updated via an unsupervised
approach to cope with the data shift between the train and test sets and
enhance the robustness of the model upon receiving a new external dataset from
a different center. We adopted an ensemble architecture to aggregate the
predictions from multiple versions of the model. For initial training and
development purposes, an in-house dataset of 171 COVID-19, 60 CAP, and 76
Normal cases was used, which contained volumetric CT scans acquired from one
imaging center using a constant standard radiation dose scanning protocol. To
evaluate the model, we collected four different test sets retrospectively to
investigate the effects of the shifts in the data characteristics on the
model's performance. Among the test cases, there were CT scans with similar
characteristics as the train set as well as noisy low-dose and ultra-low dose
CT scans. In addition, some test CT scans were obtained from patients with a
history of cardiovascular diseases or surgeries. The entire test dataset used
in this study contained 51 COVID-19, 28 CAP, and 51 Normal cases. Experimental
results indicate that our proposed framework performs well on all test sets
achieving total accuracy of 96.15% (95%CI: [91.25-98.74]), COVID-19 sensitivity
of 96.08% (95%CI: [86.54-99.5]), CAP sensitivity of 92.86% (95%CI:
[76.50-99.19]).
",Sadaf Khademi|Shahin Heidarian|Parnian Afshar|Nastaran Enshaei|Farnoosh Naderkhani|Moezedin Javad Rafiee|Anastasia Oikonomou|Akbar Shafiee|Faranak Babaki Fard|Konstantinos N. Plataniotis|Arash Mohammadi,,http://arxiv.org/abs/2109.09241v3,http://arxiv.org/pdf/2109.09241v3,,,,,eess.IV,eess.IV|cs.CV|cs.LG
2109.12986v1,2021-09-23 06:38:03,2021-09-23 06:38:03,"Findings of the NLP4IF-2021 Shared Tasks on Fighting the COVID-19
  Infodemic and Censorship Detection","  We present the results and the main findings of the NLP4IF-2021 shared tasks.
Task 1 focused on fighting the COVID-19 infodemic in social media, and it was
offered in Arabic, Bulgarian, and English. Given a tweet, it asked to predict
whether that tweet contains a verifiable claim, and if so, whether it is likely
to be false, is of general interest, is likely to be harmful, and is worthy of
manual fact-checking; also, whether it is harmful to society, and whether it
requires the attention of policy makers. Task~2 focused on censorship
detection, and was offered in Chinese. A total of ten teams submitted systems
for task 1, and one team participated in task 2; nine teams also submitted a
system description paper. Here, we present the tasks, analyze the results, and
discuss the system submissions and the methods they used. Most submissions
achieved sizable improvements over several baselines, and the best systems used
pre-trained Transformers and ensembles. The data, the scorers and the
leaderboards for the tasks are available at
http://gitlab.com/NLP4IF/nlp4if-2021.
",Shaden Shaar|Firoj Alam|Giovanni Da San Martino|Alex Nikolov|Wajdi Zaghouani|Preslav Nakov|Anna Feldman,,http://arxiv.org/abs/2109.12986v1,http://arxiv.org/pdf/2109.12986v1,,"COVID-19, infodemic, harmfulness, check-worthiness, censorship,
  social media, tweets, Arabic, Bulgarian, English, Chinese",NLP4IF-2021,,cs.CL,cs.CL|cs.IR|cs.LG|cs.SI|68T50|F.2.2; I.2.7
2109.12094v4,2021-09-24 17:40:08,2022-08-18 16:51:07,"A spatiotemporal machine learning approach to forecasting COVID-19
  incidence at the county level in the USA","  With COVID-19 affecting every country globally and changing everyday life,
the ability to forecast the spread of the disease is more important than any
previous epidemic. The conventional methods of disease-spread modeling,
compartmental models, are based on the assumption of spatiotemporal homogeneity
of the spread of the virus, which may cause forecasting to underperform,
especially at high spatial resolutions. In this paper we approach the
forecasting task with an alternative technique - spatiotemporal machine
learning. We present COVID-LSTM, a data-driven model based on a Long Short-term
Memory deep learning architecture for forecasting COVID-19 incidence at the
county-level in the US. We use the weekly number of new positive cases as
temporal input, and hand-engineered spatial features from Facebook movement and
connectedness datasets to capture the spread of the disease in time and space.
COVID-LSTM outperforms the COVID-19 Forecast Hub's Ensemble model
(COVIDhub-ensemble) on our 17-week evaluation period, making it the first model
to be more accurate than the COVIDhub-ensemble over one or more forecast
periods. Over the 4-week forecast horizon, our model is on average 50 cases per
county more accurate than the COVIDhub-ensemble. We highlight that the
underutilization of data-driven forecasting of disease spread prior to COVID-19
is likely due to the lack of sufficient data available for previous diseases,
in addition to the recent advances in machine learning methods for
spatiotemporal forecasting. We discuss the impediments to the wider uptake of
data-driven forecasting, and whether it is likely that more deep learning-based
models will be used in the future.
",Benjamin Lucas|Behzad Vahedi|Morteza Karimzadeh,,http://arxiv.org/abs/2109.12094v4,http://arxiv.org/pdf/2109.12094v4,,,,,stat.ML,stat.ML|cs.LG|stat.AP
2109.13801v1,2021-09-28 15:31:33,2021-09-28 15:31:33,No-Regret Forecasting with Egalitarian Committees,"  The forecast combination puzzle is often found in literature: The
equal-weight scheme tends to outperform sophisticated methods of combining
individual forecasts. Exploiting this finding, we propose a hedge egalitarian
committees algorithm (HECA), which can be implemented via mixed integer
quadratic programming. Specifically, egalitarian committees are formed by the
ridge regression with shrinkage toward equal weights; subsequently, the
forecasts provided by these committees are averaged by the hedge algorithm. We
establish the no-regret property of HECA. Using data collected from the ECB
Survey of Professional Forecasters, we find the superiority of HECA relative to
the equal-weight scheme during the COVID-19 recession.
",Jiun-Hua Su,,http://arxiv.org/abs/2109.13801v1,http://arxiv.org/pdf/2109.13801v1,,,,,econ.EM,econ.EM
2109.13971v2,2021-09-28 18:25:48,2021-12-09 15:52:20,"Forecasting the COVID-19 vaccine uptake rate: An infodemiological study
  in the US","  A year following the initial COVID-19 outbreak in China, many countries have
approved emergency vaccines. Public-health practitioners and policymakers must
understand the predicted populational willingness for vaccines and implement
relevant stimulation measures. This study developed a framework for predicting
vaccination uptake rate based on traditional clinical data-involving an
autoregressive model with autoregressive integrated moving average (ARIMA)- and
innovative web search queries-involving a linear regression with ordinary least
squares/least absolute shrinkage and selection operator, and machine-learning
with boost and random forest. For accuracy, we implemented a stacking
regression for the clinical data and web search queries. The stacked regression
of ARIMA (1,0,8) for clinical data and boost with support vector machine for
web data formed the best model for forecasting vaccination speed in the US. The
stacked regression provided a more accurate forecast. These results can help
governments and policymakers predict vaccine demand and finance relevant
programs.
",Xingzuo Zhou|Yiang Li,,http://arxiv.org/abs/2109.13971v2,http://arxiv.org/pdf/2109.13971v2,http://dx.doi.org/10.1080/21645515.2021.2017216,"29 pages, 6 figures, 8 tables; This article has been accepted for
  publication in Human Vaccines & Immunotherapeutics, published by Taylor &
  Francis",,10.1080/21645515.2021.2017216,stat.AP,stat.AP|econ.EM
2110.00071v2,2021-09-30 20:01:19,2021-10-06 12:53:26,"PIETS: Parallelised Irregularity Encoders for Forecasting with
  Heterogeneous Time-Series","  Heterogeneity and irregularity of multi-source data sets present a
significant challenge to time-series analysis. In the literature, the fusion of
multi-source time-series has been achieved either by using ensemble learning
models which ignore temporal patterns and correlation within features or by
defining a fixed-size window to select specific parts of the data sets. On the
other hand, many studies have shown major improvement to handle the
irregularity of time-series, yet none of these studies has been applied to
multi-source data. In this work, we design a novel architecture, PIETS, to
model heterogeneous time-series. PIETS has the following characteristics: (1)
irregularity encoders for multi-source samples that can leverage all available
information and accelerate the convergence of the model; (2) parallelised
neural networks to enable flexibility and avoid information overwhelming; and
(3) attention mechanism that highlights different information and gives high
importance to the most related data. Through extensive experiments on
real-world data sets related to COVID-19, we show that the proposed
architecture is able to effectively model heterogeneous temporal data and
outperforms other state-of-the-art approaches in the prediction task.
",Futoon M. Abushaqra|Hao Xue|Yongli Ren|Flora D. Salim,,http://arxiv.org/abs/2110.00071v2,http://arxiv.org/pdf/2110.00071v2,,Accepted to ICDM2021,,,cs.LG,cs.LG|cs.AI
